{
  "correlationId": "10000000-0000-4000-8000-000000000001",
  "messageId": "10000000-0000-4000-8000-000000000002",
  "occurredOn": "2026-10-29T12:00:00+00:00",
  "vehicleId": "10000000-0000-4000-8000-000000000007",
  "serviceOrderCode": 45,
  "requestedJobs": [
    {
      "lineId": "10000000-0000-4000-8000-000000000008",
      "catalogJobId": "10000000-0000-4000-8000-000000000009"
    }
  ],
  "requestedParts": [
    {
      "lineId": "10000000-0000-4000-8000-000000000010",
      "partId": "10000000-0000-4000-8000-000000000011",
      "quantity": 1
    }
  ]
}
